UUID;Teste automático;Modo;Tratamento;Tabela (Modbus);Tipo (Modbus);Registrador (Modbus);Tipo (DNP3);Índice (DNP3);Limite inferior;Limite superior;Valor default;Divisor;Unidade pt;Unidade en;Unidade es;Conversão pt;Conversão en;Conversão es;Opcional;Condicional;Nível de acesso;Descrição pt;Descrição en;Descrição es;Display pt;Display en;Display es;Observações;Funcionalidade pt;Funcionalidade en;Funcionalidade es;Grupo pt;Grupo en;Grupo es;Classificação;Gráfico rápido;Histórico de dados;IEC 61850;Link;CDC
0ed281d25ec84b1b91db4a8cb8476a62;1;R;Bit;TabLeituraBinEnvelhecimento;Discrete input;12028;Binary input;119;0;1;0;1;;;;0=Inativo\1=Ativo;0=Inactive\1=Active;;AGNG;;Público;Indicação de alarme por vida útil do enrolamento 6 - Baixa;Indication of alarm by winding 6 lifespan - Low;;;;;;;;;Envelhecimento;;;Alarme;;;SDp_LAP_$SPTR6$ST$AlmTmLo$stVal;;
3bd69b67178f4855a8e03fd9d159d049;1;R;Bit;TabLeituraBinEnvelhecimento;Discrete input;12029;Binary input;120;0;1;0;1;;;;0=Inativo\1=Ativo;0=Inactive\1=Active;;AGNG;;Público;Indicação de memória de alarme por vida útil do enrolamento 6 - Baixa;Indication of alarm memory by winding 6 lifespan - Low;;;;;;;;;;;;Debug;;;;;
;;;;;;;;;;;;;;;;;;;;;;;;;;;;;;;;;;;;;;;;
0bd9be5f002c4afcb31114c485323d11;1;RW;16;TabEscritaEnvelhecimento;Holding register;12000;Analog output;49;1;6;6;1;;;;;;;AGNG;;Público;Parâmetro de configuração da quantidade de enrolamentos disponíveis;Parameter of available windings quantity;;;INAG\WNR;;;;;;Envelhecimento;Aging;;Parâmetro;;;;;
c2d899bfaab54577b04464e921dee61e;1;RW;16;TabEscritaEnvelhecimento;Holding register;12001;Analog output;50;0;1;1;1;;;;0=IEEE\1=IEC;0=IEEE\1=IEC;;AGNG;;Público;Parâmetro de norma de referência para cálculo de envelhecimento;Parameter of aging calculations reference standard;;;INAG\STND;;;;;;Envelhecimento;Aging;;Parâmetro;;;;;
9118a9b5e26c4f3184f3584abd8b4b4d;1;RW;16;TabEscritaEnvelhecimento;Holding register;12002;Analog output;51;0;2;1;1;;;;0=150\1=180\2=200;0=150\1=180\2=200;;AGNG;;Público;Parâmetro de classe de isolamento para a norma IEEE;Parameter of insulation class to IEEE standard;;;INAG\INSU;;;;;;Envelhecimento;Aging;;Parâmetro;;;;;
57a7178e48184b9e8cc44b31c8eac830;1;RW;16;TabEscritaEnvelhecimento;Holding register;12003;Analog output;52;0;6;4;1;;;;0=105A\1=120E\2=130B\3=155F\4=180H\5=200\6=220;0=105a\1=120e\2=130b\3=155f\4=180H\5=200\6=220;;AGNG;;Público;Parâmetro de classe de isolamento para a norma IEC;Parameter of insulation class to IEC standard;;;INAG\INSU;;;;;;Envelhecimento;Aging;;Parâmetro;;;;;
2dd8af4a26d9413eb4d2a6e24b69db19;1;RW;16;TabEscritaEnvelhecimento;Holding register;12004;Analog output;53;0;100;100;1;%;;;;;;AGNG;;Público;Parâmetro de vida útil inicial do enrolamento 1;Parameter of winding 1 inicial lifespan;;;INAG\INL1;;;;;;Envelhecimento;Aging;;Parâmetro;;;;;
7aab85a4ee984b899fc8a13013717210;1;RW;16;TabEscritaEnvelhecimento;Holding register;12005;Analog output;54;0;100;100;1;%;;;;;;AGNG;;Público;Parâmetro de vida útil inicial do enrolamento 2;Parameter of winding 2 inicial lifespan;;;INAG\INL2;;;;;;Envelhecimento;Aging;;Parâmetro;;;;;
12ed9bfd609344fdaa7bd7760bbac2b0;1;RW;16;TabEscritaEnvelhecimento;Holding register;12006;Analog output;55;0;100;100;1;%;;;;;;AGNG;;Público;Parâmetro de vida útil inicial do enrolamento 3;Parameter of winding 3 inicial lifespan;;;INAG\INL3;;;;;;Envelhecimento;Aging;;Parâmetro;;;;;
44f8f8a846074284b4f3f2f129106d3c;1;RW;16;TabEscritaEnvelhecimento;Holding register;12007;Analog output;56;0;100;100;1;%;;;;;;AGNG;;Público;Parâmetro de vida útil inicial do enrolamento 4;Parameter of winding 4 inicial lifespan;;;INAG\INL4;;;;;;Envelhecimento;Aging;;Parâmetro;;;;;
65f2117b265e4bfea90c4fb327e84cf8;1;RW;16;TabEscritaEnvelhecimento;Holding register;12008;Analog output;57;0;100;100;1;%;;;;;;AGNG;;Público;Parâmetro de vida útil inicial do enrolamento 5;Parameter of winding 5 inicial lifespan;;;INAG\INL5;;;;;;Envelhecimento;Aging;;Parâmetro;;;;;
0bdd010a09a246a98036ccd05cc563d4;1;RW;16;TabEscritaEnvelhecimento;Holding register;12009;Analog output;58;0;100;100;1;%;;;;;;AGNG;;Público;Parâmetro de vida útil inicial do enrolamento 6;Parameter of winding 6 inicial lifespan;;;INAG\INL6;;;;;;Envelhecimento;Aging;;Parâmetro;;;;;
41bcda8c12fc411a9a8ea4967b740d08;1;RW;16;TabEscritaEnvelhecimento;Holding register;12010;Analog output;59;0;100;25;1;%;;;;;;AGNG;;Público;Parâmetro de alarme por vida útil - Baixo;Parameter of alarm by lifespan - Low;;;INAG\LOLF;;;;;;Envelhecimento;Aging;;Parâmetro;;;;;
c53e272fd7f9490a9e10a8f3b935dd53;1;RW;16;TabEscritaEnvelhecimento;Holding register;12011;Analog output;60;0;20;1;1;anos;years;ãnos;;;;AGNG;;Público;Parâmetro de alarme por tempo de vida restante - Baixo;Parameter of alarm by remaining lifetime - Low;;;INAG\LOLT;;;;;;Envelhecimento;Aging;;Parâmetro;;;;;
6c23b4988a9640cc98da59ef48d7e39c;1;RW;16;TabEscritaEnvelhecimento;Holding register;12012;Analog output;61;1;720;24;1;horas;hours;horas;;;;AGNG;;Público;Parâmetro de constante de tempo de tendência;Parameter of trend time constant;;;INAG\FILT;;;;;;Envelhecimento;Aging;;Parâmetro;;;;;
;;;;;;;;;;;;;;;;;;;;;;;;;;;;;;;;;;;;;;;;
c95db19abbd2429fa3da47b7aa4fdfc9;1;RW;Bit;TabEscritaBinEnvelhecimento;Coil;12000;Binary output;57;0;1;0;1;;;;0=-\1=Efetua reset;0=-\1=Perform reset;;AGNG;;Público;Comando de reset dos cálculos do envelhecimento;Command of aging calculations reset;;;RSET;;;;;;;;;Comando;;;;;
;;;;;;;;;;;;;;;;;;;;;;;;;;;;;;;;;;;;;;;;
371a6fe5e1e54150932c1021cfeb5516;1;R;16;TabLeituraControleLogUsuario;Input register;20000;;;0;65535;0;1;;;;;;;;;Log de massa/Privado;Tamanho da página de download do log MMEM;;;;;;;;;;;;;;;;;;
80aca3cab2c0425d96e35c46ee3287f3;1;R;16;TabLeituraControleLogUsuario;Input register;20001;;;0;65535;0;1;;;;;;;;;Log de massa/Privado;Número máximo de páginas do log MMEM;;;;;;;;;;;;;;;;;;
57a2247ddf654d818d76b100fc627b20;1;R;16;TabLeituraControleLogUsuario;Input register;20002;;;0;65535;0;1;;;;;;;;;Log de massa/Privado;Próximo índice de página a ser salva do log MMEM;;;;;;;;;;;;;;;;;;
828f345d90a64384885a00c9737222e1;1;R;16;TabLeituraControleLogUsuario;Input register;20003;;;0;65535;0;1;;;;;;;;;Log de auditoria/Privado;Número máximo de páginas do log de auditoria;;;;;;;;;;;;;;;;;;
117092364cb84f01bf287e8bd537a59a;1;R;16;TabLeituraControleLogUsuario;Input register;20004;;;0;65535;0;1;;;;;;;;;Log de auditoria/Privado;Próximo índice de página a ser salva do log de auditoria;;;;;;;;;;;;;;;;;;
;;;;;;;;;;;;;;;;;;;;;;;;;;;;;;;;;;;;;;;;
b97ee667748b4cb0a72f5a7b1925a0ac;1;R;Bit;TabLeituraBinControleLogUsuario;Discrete input;20000;;;0;1;0;1;;;;0=Não ocorreu loop/1=Ocorreu loop;;;;;Log de massa/Privado;Flag de controle de loop do log MMEM;;;;;;;;;;;;;;;;;;
189a5c054aca4e7a9101b8bd545ee8e4;1;R;Bit;TabLeituraBinControleLogUsuario;Discrete input;20001;;;0;1;0;1;;;;0=Não ocorreu loop/1=Ocorreu loop;;;;;Log de auditoria/Privado;Flag de controle de loop do log de auditoria;;;;;;;;;;;;;;;;;;
;;;;;;;;;;;;;;;;;;;;;;;;;;;;;;;;;;;;;;;;
2a3604c3a8774af1b7dd9538a282d07d;1;RW;16;TabEscritaControleLogUsuario;Holding register;20000;;;0;127;0;1;;;;;;;;;Log de massa/Privado;Índice para download do log MMEM;;;;;;;;;;;;;;;;;;
cb15a48efc204c3b9c2ed4cd363544dd;1;RW;16;TabEscritaControleLogUsuario;Holding register;20001;;;0;84;0;1;;;;;;;;;Log de auditoria/Privado;Índice para download do log de auditoria;;;;;;;;;;;;;;;;;;
;;;;;;;;;;;;;;;;;;;;;;;;;;;;;;;;;;;;;;;;
ab8b59d7e56149d2a302ff9da6eb2be6;1;RW;Bit;TabEscritaBinControleLogUsuario;Coil;20000;;;0;1;0;1;;;;0=Desativado\1=Ativado;;;;;Log de massa/Privado;Configuração de autoincremento no download do log MMEM;;;;;;;;;;;;;;;;;;
1ac6262555fd4726b3b22226e5d67b57;1;RW;Bit;TabEscritaBinControleLogUsuario;Coil;20001;;;0;1;0;1;;;;0=Desativado\1=Ativado;;;;;Log de auditoria/Privado;Configuração de autoincremento no download do log de auditoria;;;;;;;;;;;;;;;;;;
;;;;;;;;;;;;;;;;;;;;;;;;;;;;;;;;;;;;;;;;
f16387cbcfc64c4f882831e83b9fd839;0;R;16;TabLeituraMMEMDownload;Input register;21000;;;0;65535;65535;1;;;;;;;;;Log de massa/Privado;Registros para download do log MMEM;;;;;;MASSA(125)!!!;;;;;;;;;;;;
a0d1c0a6bdf9470ea6944ca016219f69;0;R;16;TabLeituraAuditoriaDownload;Input register;22000;;;0;65535;65535;1;;;;;;;;;Log de auditoria/Privado;Registros para download do log de auditoria;;;;;;MASSA(117)!!!;;;;;;;;;;;;
;;;;;;;;;;;;;;;;;;;;;;;;;;;;;;;;;;;;;;;;
a47d84ff3ae14a6c857c224c61a238be;1;R;16;TabLeituraControleAcessoFab;Input register;30000;;;0;9999;0;1;;;;;;;;;Fábrica;Contrassenha para acesso aos registros de calibração;;;;;;;;;;;;;;;;;;
94f8c32daf7341c09a54342afbe8bd79;1;R;16;TabLeituraControleAcessoFab;Input register;30001;;;0;300;0;1;s;;;;;;;;Fábrica;Tempo restante para acesso aos registros de calibração;;;;;;;;;;;;;;;;;;
87f47017ebb54a45b74469a1252d6d3d;1;R;16;TabLeituraControleAcessoFab;Input register;30002;;;0;9999;0;1;;;;;;;;;Fábrica;Contrassenha para acesso aos registros do número de série;;;;;;;;;;;;;;;;;;
160fe3ef1b694c35baa8ba9dd62e85e3;1;R;16;TabLeituraControleAcessoFab;Input register;30003;;;0;300;0;1;s;;;;;;;;Fábrica;Tempo restante para acesso aos registros do número de série;;;;;;;;;;;;;;;;;;
3c7c0545a55b4f31ac86da71f1f0135e;1;R;16;TabLeituraControleAcessoFab;Input register;30004;;;0;9999;0;1;;;;;;;;;Fábrica;Contrassenha para acesso aos registros dos opcionais;;;;;;;;;;;;;;;;;;
eb4b93f0385f4e81a2494af1e2ccd35e;1;R;16;TabLeituraControleAcessoFab;Input register;30005;;;0;300;0;1;s;;;;;;;;Fábrica;Tempo restante para acesso aos registros dos opcionais;;;;;;;;;;;;;;;;;;
b775c0b1c24a42f69d0535711b4ce1d6;1;R;16;TabLeituraControleAcessoFab;Input register;30006;;;0;9999;0;1;;;;;;;;;Fábrica;Contrassenha para acesso ao registro do modo fábrica;;;;;;;;;;;;;;;;;;
6cf5685ff28344b0b1e695132ae67725;1;R;16;TabLeituraControleAcessoFab;Input register;30007;;;0;300;0;1;s;;;;;;;;Fábrica;Tempo restante para acesso ao registro do modo fábrica;;;;;;;;;;;;;;;;;;
8dcc0125dd354a109adbe419628d65db;1;R;16;TabLeituraControleAcessoFab;Input register;30008;;;0;9999;0;1;;;;;;;;;Fábrica;Contrassenha para acesso aos registros da sanidade;;;;;;;;;;;;;;;;;;
a154d75245474ef5abed0db56466aff6;1;R;16;TabLeituraControleAcessoFab;Input register;30009;;;0;300;0;1;s;;;;;;;;Fábrica;Tempo restante para acesso aos registros da sanidade;;;;;;;;;;;;;;;;;;
2281581d5f234b96a6b2b1261b10b4a4;1;R;16;TabLeituraControleAcessoFab;Input register;30010;;;0;9999;0;1;;;;;;;;;Fábrica;Contrassenha para acesso aos registros de comando da flash;;;;;;;;;;;;;;;;;;
d6b9fabba21743e3bd224c8b2f3b5cf1;1;R;16;TabLeituraControleAcessoFab;Input register;30011;;;0;300;0;1;s;;;;;;;;Fábrica;Tempo restante para acesso aos registros de comando da flash;;;;;;;;;;;;;;;;;;
1ac7a26c696244d5b53f64b3b6a4f811;1;R;16;TabLeituraControleAcessoFab;Input register;30012;;;0;9999;0;1;;;;;;;;;Fábrica;Contrassenha para acesso ao registro de reset do log de fábrica;;;;;;;;;;;;;;;;;;
e98645c8ce764371bb418ae2a4b4349c;1;R;16;TabLeituraControleAcessoFab;Input register;30013;;;0;300;0;1;s;;;;;;;;Fábrica;Tempo restante para acesso ao registro de reset do log de fábrica;;;;;;;;;;;;;;;;;;
;;;;;;;;;;;;;;;;;;;;;;;;;;;;;;;;;;;;;;;;
dfcfcf3b4e6b404e9cbf98e42eab2b64;1;R;Bit;TabLeituraBinControleAcessoFab;Discrete input;30000;;;0;1;0;1;;;;0=Bloqueado\1=Liberado;;;;;Fábrica;Status do acesso aos registros de calibração;;;;;;;;;;;;;;;;;;
de88cc40d3c245d59b1bb1b55e674dcb;1;R;Bit;TabLeituraBinControleAcessoFab;Discrete input;30001;;;0;1;0;1;;;;0=Bloqueado\1=Liberado;;;;;Fábrica;Status do acesso aos registros do número de série;;;;;;;;;;;;;;;;;;
7943df73b6244c138d73f00021b0580e;1;R;Bit;TabLeituraBinControleAcessoFab;Discrete input;30002;;;0;1;0;1;;;;0=Bloqueado\1=Liberado;;;;;Fábrica;Status do acesso aos registros dos opcionais;;;;;;;;;;;;;;;;;;
4022e039cb2e4d60bafbf9a1e8cfa302;1;R;Bit;TabLeituraBinControleAcessoFab;Discrete input;30003;;;0;1;0;1;;;;0=Bloqueado\1=Liberado;;;;;Fábrica;Status do acesso ao registro do modo fábrica;;;;;;;;;;;;;;;;;;
07c614edcad14482a8dac6f29be12aae;1;R;Bit;TabLeituraBinControleAcessoFab;Discrete input;30004;;;0;1;0;1;;;;0=Bloqueado\1=Liberado;;;;;Fábrica;Status do acesso aos registros da sanidade;;;;;;;;;;;;;;;;;;
b0cda93daf58404c8e1f3009ca831eec;1;R;Bit;TabLeituraBinControleAcessoFab;Discrete input;30005;;;0;1;0;1;;;;0=Bloqueado\1=Liberado;;;;;Fábrica;Status do acesso aos registros de comando da flash;;;;;;;;;;;;;;;;;;
51ad80787d0a4afe8a7654e40772fae3;1;R;Bit;TabLeituraBinControleAcessoFab;Discrete input;30006;;;0;1;0;1;;;;0=Bloqueado\1=Liberado;;;;;Fábrica;Status do acesso aos registro de reset do log de fábrica;;;;;;;;;;;;;;;;;;
;;;;;;;;;;;;;;;;;;;;;;;;;;;;;;;;;;;;;;;;
a6b2c2f1b3a2413bab7e79aaa89acc55;1;RW;16;TabEscritaControleAcessoFab;Holding register;30000;;;0;9999;0;1;;;;;;;;;Fábrica;Senha para acesso aos registros de calibração;;;;;;;;;;;;;;;;;;
7010a3168c394decb632c5043133ac3d;1;RW;16;TabEscritaControleAcessoFab;Holding register;30001;;;0;9999;0;1;;;;;;;;;Fábrica;Senha para acesso aos registros do número de série;;;;;;;;;;;;;;;;;;
15018c05a69142bb8918381c61bc13e9;1;RW;16;TabEscritaControleAcessoFab;Holding register;30002;;;0;9999;0;1;;;;;;;;;Fábrica;Senha para acesso aos registros dos opcionais;;;;;;;;;;;;;;;;;;
b0e7b69f784140a9a133ea369ed52971;1;RW;16;TabEscritaControleAcessoFab;Holding register;30003;;;0;9999;0;1;;;;;;;;;Fábrica;Senha para acesso ao registro do modo fábrica;;;;;;;;;;;;;;;;;;
efc50f0cbd4b4f1bb2a1f87df8ff19ab;1;RW;16;TabEscritaControleAcessoFab;Holding register;30004;;;0;9999;0;1;;;;;;;;;Fábrica;Senha para acesso aos registros da sanidade;;;;;;;;;;;;;;;;;;
bc1d92e005f3469e9cec92fc0b6fbe57;1;RW;16;TabEscritaControleAcessoFab;Holding register;30005;;;0;9999;0;1;;;;;;;;;Fábrica;Senha para acesso aos registros de comando da flash;;;;;;;;;;;;;;;;;;
30c2606349c94d1c814dabe877086430;1;RW;16;TabEscritaControleAcessoFab;Holding register;30006;;;0;9999;0;1;;;;;;;;;Fábrica;Senha para acesso ao registro de reset do log de fábrica;;;;;;;;;;;;;;;;;;
;;;;;;;;;;;;;;;;;;;;;;;;;;;;;;;;;;;;;;;;
71553e91bd804537becb5adb71d1ad6f;1;RW;16;TabEscritaFabrica;Holding register;30100;;;0;600;0;10;ohms;;;;;;;;Fábrica;Resistor de referência 1 (somado a 100 ohms);;;;RR1;;;;;;;;;;;;;;
5380c180d35c415887573fe0b55f5c81;1;RW;16;TabEscritaFabrica;Holding register;30101;;;0;600;500;10;ohms;;;;;;;;Fábrica;Resistor de referência 2 (somado a 100 ohms);;;;RR2;;;;;;;;;;;;;;
b44cc821015449dbb41f3bcb4148186f;1;RW;16;TabEscritaFabrica;Holding register;30102;;;-999;9999;-2;1;;;;;;;;;Fábrica;Calibração da resistência de trilha do RTD1;;;;CRT1;;;;;;;;;;;;;;
9208d81e899f45a2a567e2873029f5bf;1;RW;16;TabEscritaFabrica;Holding register;30103;;;-999;9999;-2;1;;;;;;;;;Fábrica;Calibração da resistência de trilha do RTD2;;;;CRT2;;;;;;;;;;;;;;
516f53ec33ec47c18122788adabdbf72;1;RW;16;TabEscritaFabrica;Holding register;30104;;;-999;9999;-2;1;;;;;;;;;Fábrica;Calibração da resistência de trilha do RTD3;;;;CRT3;;;;;;;;;;;;;;
e12fdb2c44aa496c8367f5d62fc1819c;1;RW;16;TabEscritaFabrica;Holding register;30105;;;-999;9999;-2;1;;;;;;;;;Fábrica;Calibração da resistência de trilha do RTD4;;;;CRT4;;;;;;;;;;;;;;
7045d1cf875d48398caeae3b5c97e5d4;1;RW;16;TabEscritaFabrica;Holding register;30106;;;-999;9999;-2;1;;;;;;;;;Fábrica;Calibração da resistência de trilha do RTD5;;;;CRT5;;;;;;;;;;;;;;
268cdb3f6881456cb49bc1f9214dd75e;1;RW;16;TabEscritaFabrica;Holding register;30107;;;-999;9999;-2;1;;;;;;;;;Fábrica;Calibração da resistência de trilha do RTD6;;;;CRT6;;;;;;;;;;;;;;
861d93d6e07741569883ff32dfde8e49;1;RW;16;TabEscritaFabrica;Holding register;30108;;;0;100;50;1;%;;;;;;;;Fábrica;Referência de calibração da saída mA;;;;CREF;;;;;;;;;;;;;;
a5d8a70bb5d6467ebebe4c379e1a5d71;1;RW;16;TabEscritaFabrica;Holding register;30109;;;0;2000;2000;100;%;;;;;;;;Fábrica;Fator de calibração da escala de 0 a 1mA;;;;C1;;;;;;;;;;;;;;
0f495460d98341628365098776c71e0f;1;RW;16;TabEscritaFabrica;Holding register;30110;;;0;2000;2000;100;%;;;;;;;;Fábrica;Fator de calibração da escala de 0 a 5mA;;;;C5;;;;;;;;;;;;;;
8c8d00f5f41c488c8127a337a4b95f49;1;RW;16;TabEscritaFabrica;Holding register;30111;;;0;2000;2000;100;%;;;;;;;;Fábrica;Fator de calibração da escala de 0 a 10mA;;;;C10;;;;;;;;;;;;;;
a52529bd079e400088ec29bd60e9efe9;1;RW;16;TabEscritaFabrica;Holding register;30112;;;0;2000;2000;100;%;;;;;;;;Fábrica;Fator de calibração da escala de 0 a 20mA (e 4 a 20mA);;;;C20;;;;;;;;;;;;;;
;;;;;;;;;;;;;;;;;;;;;;;;;;;;;;;;;;;;;;;;
a9071969d83e4e619d790d07c58e9c06;1;RW;32_ABCD;TabEscritaFabrica32bits;Holding register;30200;;;0;9999999;0;1;;;;;;;;;Fábrica;Número de série;;;;;;;;;;;;;;;;;;
;;;;;;;;;;;;;;;;;;;;;;;;;;;;;;;;;;;;;;;;
6d1a70aae3f94adbb2521507bb287c05;1;RW;Bit;TabEscritaBinControleAcesso;Coil;30000;;;0;1;0;1;;;;0=-\1=Solicita acesso;;;;;Fábrica;Solicita acesso aos registros de calibração;;;;;;;;;;;;;;;;;;
2cf425ad7554470b9aff23bbc12476c0;1;RW;Bit;TabEscritaBinControleAcesso;Coil;30001;;;0;1;0;1;;;;0=-\1=Solicita acesso;;;;;Fábrica;Solicita acesso aos registros do número de série;;;;;;;;;;;;;;;;;;
a1328bf30b8d4e05a0017273146f11b3;1;RW;Bit;TabEscritaBinControleAcesso;Coil;30002;;;0;1;0;1;;;;0=-\1=Solicita acesso;;;;;Fábrica;Solicita acesso aos registros dos opcionais;;;;;;;;;;;;;;;;;;
b3bd355dc9914088977510cd8aeed39f;1;RW;Bit;TabEscritaBinControleAcesso;Coil;30003;;;0;1;0;1;;;;0=-\1=Solicita acesso;;;;;Fábrica;Solicita acesso ao registro do modo fábrica;;;;;;;;;;;;;;;;;;
55e6c16207ff4c71a267384587f03731;1;RW;Bit;TabEscritaBinControleAcesso;Coil;30004;;;0;1;0;1;;;;0=-\1=Solicita acesso;;;;;Fábrica;Solicita acesso aos registros da sanidade;;;;;;;;;;;;;;;;;;
ba699900851344c893289a91989e4156;1;RW;Bit;TabEscritaBinControleAcesso;Coil;30005;;;0;1;0;1;;;;0=-\1=Solicita acesso;;;;;Fábrica;Solicita acesso aos registros de comando da flash;;;;;;;;;;;;;;;;;;
12d190757fe1447499ad407ce8e2a1ae;1;RW;Bit;TabEscritaBinControleAcesso;Coil;30006;;;0;1;0;1;;;;0=-\1=Solicita acesso;;;;;Fábrica;Solicita acesso ao registro de reset do log de fábrica;;;;;;;;;;;;;;;;;;
;;;;;;;;;;;;;;;;;;;;;;;;;;;;;;;;;;;;;;;;
9bce8d7edc4e45f9ab0f3adf1d8f7aa0;1;RW;Bit;TabEscritaBinFabrica;Coil;30100;;;0;1;0;1;;;;0=Desativado\1=Ativado;;;;;Fábrica;Opcional envelhecimento;;;;;;;;;;;;;;;;;;
3bf4e86b693b4504b3ff0cc90029ec7c;0;RW;Bit;TabEscritaBinFabrica;Coil;30101;;;0;1;0;1;;;;0=Desativado\1=Ativado;;;;;Fábrica;Modo fábrica;;;;FACM;;;;;;;;;;;;;;
726efd7dce89492daab5f5f44eb3d579;1;RW;Bit;TabEscritaBinFabrica;Coil;30102;;;0;1;1;1;;;;0=Desativado\1=Ativado;;;;;Fábrica;Habilita a verificação da passagem de token da sanidade;;;;SNTE;;;;;;;;;;;;;;
d5e20472b688429bbb53d942ada0157b;1;RW;Bit;TabEscritaBinFabrica;Coil;30103;;;0;1;1;1;;;;0=Desativado\1=Ativado;;;;;Fábrica;Habilita a verificação dos períodos da sanidade;;;;SNPR;;;;;;;;;;;;;;
8e06aae10fe444c5864ca71e242ae4cd;0;RW;Bit;TabEscritaBinFabrica;Coil;30104;;;0;1;0;1;;;;;;;;;Fábrica;Comando de reset dos valores default de fábrica;;;;DFLT;;;;;;;;;;;;;;
18b323192d7a49c1bc76ae3eb7560296;0;RW;Bit;TabEscritaBinFabrica;Coil;30105;;;0;1;0;1;;;;;;;;;Fábrica;Comando de reset da memória flash;;;;RSET;;;;;;;;;;;;;;
77d2fa48b7e4461d8f09dae2f1193767;0;RW;Bit;TabEscritaBinFabrica;Coil;30106;;;0;1;0;1;;;;;;;;;Fábrica;Comando de reset do log de fábrica;;;;RSET;;;;;;;;;;;;;;
8df7b310b58a405b8adfa38853e869ed;0;RW;Bit;TabEscritaBinFabrica;Coil;30107;;;0;1;0;1;;;;;;;;;Fábrica;Comando de reset do log de sanidade;;;;RSET;;;;;;;;;;;;;;
;;;;;;;;;;;;;;;;;;;;;;;;;;;;;;;;;;;;;;;;
d0afa27279be4612ba8c70ad9ffc13c7;1;R;32_ABCD;TabLeituraHardware;Input register;45000;Analog input;0;0;9999999;0;1;;;;;;;;;Público;Indicação de número de série;Indication of serial number;;;;;;;;;Informações do IED;IED informations;;Geral;;;;;
56bed56c30cb46cebf37f954ebbf2ffc;1;R;16;TabLeituraHardware;Input register;45002;Analog input;2;0;999;0;1;;;;;;;;;Público;Indicação de versão da funcionalidade;Indication of funcionality version;;;;;;;;;Informações do IED;IED informations;;Geral;;;;;
8648fed5b31d4f67ab4899b8f26c7cea;1;R;16;TabLeituraHardware;Input register;45003;Analog input;3;0;999;0;1;;;;;;;;;Público;Indicação de release da funcionalidade;Indication of funcionality release;;;RLSE;;;;;;Informações do IED;IED informations;;Geral;;;;;
e501cac3a4ec43a9be62c2434a37c875;1;R;16;TabLeituraHardware;Input register;45004;Analog input;4;0;999;0;1;;;;;;;;;Público;Indicação de versão do bootloader;Indication of bootloader version;;;;;;;;;Informações do IED;IED informations;;Geral;;;;;
caeeefd29cd24a508c82b08ab0414089;1;R;16;TabLeituraHardware;Input register;45005;Analog input;5;0;999;0;1;;;;;;;;;Público;Indicação de release do bootloader;Indication of bootloader release;;;BLRL;;;;;;Informações do IED;IED informations;;Geral;;;;;
d7c55279353e4f69ad8a0c3a68cdf6a3;1;R;16;TabLeituraHardware;Input register;45006;Analog input;6;0;65535;131;1;;;;;;;;;Público;Indicação de código da funcionalidade;Indication of funcionality code;;;;;;;;;Informações do IED;IED informations;;Geral;;;;;
14c1c40ecbdd431f8dfd5f4765f20ff7;0;R;16;TabLeituraAutoteste;Input register;45007;;;0;65535;0;1;;;;;;;;;Uso interno;Versão do firmware ao finalizar o autoteste;;;;;;;;;;;;;;;;;;
8dff9df88d3b4b9cb8a864ebb54bcea7;0;R;16;TabLeituraAutoteste;Input register;45008;;;0;65535;0;1;;;;;;;;;Uso interno;Release do firmware ao finalizar o autoteste;;;;;;;;;;;;;;;;;;
b9698447130846d6833ebf1c2746e70d;0;R;16;TabLeituraAutoteste;Input register;45009;;;0;65535;0;1;;;;;;;;;Uso interno;Word alta do timestamp que registra a data de execução do autoteste;;;;;;;;;;;;;;;;;;
05d7e2c5fb144380b01fe5e8aaa86516;0;R;16;TabLeituraAutoteste;Input register;45010;;;0;65535;0;1;;;;;;;;;Uso interno;Word média do timestamp que registra a data de execução do autoteste;;;;;;;;;;;;;;;;;;
6254b37a844849488b94d759b04b86ef;0;R;16;TabLeituraAutoteste;Input register;45011;;;0;65535;0;1;;;;;;;;;Uso interno;Word baixa do timestamp que registra a data de execução do autoteste;;;;;;;;;;;;;;;;;;
;;;;;;;;;;;;;;;;;;;;;;;;;;;;;;;;;;;;;;;;
648340e5c5a44bdc861d9d775709aea9;1;R;Bit;TabLeituraBinHardware;Discrete input;45000;;;0;1;0;1;;;;0=Desativado\1=Ativado;0=Deactivated\1=activated;;;;Público;Indicação de opcional - Monitoração do envelhecimento da isolação;Indication of opcional - Isolation aging monitorating;;;INAG;;;;;;;;;Debug;;;;;
;;;;;;;;;;;;;;;;;;;;;;;;;;;;;;;;;;;;;;;;
265f4455683a40eebc818da103aea3b1;1;RW;16;TabEscritaHardware;Holding register;45000;;;0;65535;0;1;;;;;;;;;Uso interno;Registro de comando 1;;;;;;;;;;;;;;;;;;
e7553dcc71ca48dfaa17d00f9e305765;1;RW;16;TabEscritaHardware;Holding register;45001;;;0;65535;0;1;;;;;;;;;Uso interno;Registro de comando 2;;;;;;;;;;;;;;;;;;
cdb5adf7ad1d435f89a7a90a29a9c07a;1;RW;16;TabEscritaHardware;Holding register;45002;;;0;5299;0;1;;;;;;;;;Uso interno;Revisão da placa;;;;;;;;;;;;;;;;;;
;;;;;;;;;;;;;;;;;;;;;;;;;;;;;;;;;;;;;;;;
daba0f914dc64bf5a5da451817b2573c;1;RW;16;TabEscritaRelogio;Holding register;45100;Analog output;64;-12;14;-3;1;horas;;;;;;;;Público;Parâmetro de configuração do relógio - Fuso em horas;Parameter of clock configuration - Time zone hours;;;;;;;;;;;;;;;;;
c383aa6a07ea4361a564795c18b4f6ab;1;RW;16;TabEscritaRelogio;Holding register;45101;Analog output;65;0;59;0;1;min;;;;;;;;Público;Parâmetro de configuração do relógio - Fuso em minutos;Parameter of clock configuration - Time zone minutes;;;;;;;;;;;;;;;;;
d54e718ab7eb46479e1f69e960c0b9b7;1;RW;16;TabEscritaRelogio;Holding register;45102;;;1;12;1;1;;;;;;;;;Público;Parâmetro de configuração do relógio (UTC) - Mês;Parameter of clock configuration (UTC) - Month;;;;;;;;;;;;;;;;;
5838349b92d04d75991d90547b0a25fc;1;RW;16;TabEscritaRelogio;Holding register;45103;;;1;31;1;1;;;;;;;;;Público;Parâmetro de configuração do relógio (UTC) - Dia;Parameter of clock configuration (UTC) - Day;;;;;;;;;;;;;;;;;
90ff8e4380124d79820f637ff52e52f9;1;RW;16;TabEscritaRelogio;Holding register;45104;;;2000;2099;2000;1;;;;;;;;;Público;Parâmetro de configuração do relógio (UTC) - Ano;Parameter of clock configuration (UTC) - Year;;;;;;;;;;;;;;;;;
db9b9b9345d94858bfbb04a106a41279;1;RW;16;TabEscritaRelogio;Holding register;45105;;;0;23;10;1;horas;;;;;;;;Público;Parâmetro de configuração do relógio (UTC) - Hora;Parameter of clock configuration (UTC) - Hour;;;;;;;;;;;;;;;;;
2a98304831cf4cf181ae3a57e7a544d7;1;RW;16;TabEscritaRelogio;Holding register;45106;;;0;59;0;1;min;;;;;;;;Público;Parâmetro de configuração do relógio (UTC) - Minuto;Parameter of clock configuration (UTC) - Minute;;;;;;;;;;;;;;;;;
c8fb92ea5eb04f1d8e20bd42e5e5b288;1;RW;16;TabEscritaRelogio;Holding register;45107;;;0;59;0;1;s;;;;;;;;Público;Parâmetro de configuração do relógio (UTC) - Segundos;Parameter of clock configuration (UTC) -Second;;;;;;;;;;;;;;;;;
;;;;;;;;;;;;;;;;;;;;;;;;;;;;;;;;;;;;;;;;
2995a2cb78cb4376a70874fb53084f0e;1;RW;Bit;TabEscritaBinRelogio;Coil;45000;;;0;1;0;1;;;;0=-\1=Executa o comando;0=-\1=Execute the command;;;;Público;Comando de aplicar a configuração do relógio;Command of apply clock settings;;;;;;;;;;;;Comando;;;;;
;;;;;;;;;;;;;;;;;;;;;;;;;;;;;;;;;;;;;;;;
a25a95d445f54a8599c5d0b43f22c797;0;RW;Bit;TabEscritaBinBitsAlteracao;Coil;50000;;;0;1;0;1;;;;0=Tabelas não alteradas\1=Tabelas alteradas;;;;;Uso interno;Bits de alteração discrete input;;;;;;MASSA(500)!!!;;;;;;;;;;;;
003793c46b46453fa7ffca39e4239a3f;0;RW;Bit;TabEscritaBinBitsAlteracao;Coil;50500;;;0;1;0;1;;;;0=Tabelas não alteradas\1=Tabelas alteradas;;;;;Uso interno;Bits de alteração coils;;;;;;MASSA(500)!!!;;;;;;;;;;;;
320595490321409dae8f88a25debf1ed;0;RW;Bit;TabEscritaBinBitsAlteracao;Coil;51000;;;0;1;0;1;;;;0=Tabelas não alteradas\1=Tabelas alteradas;;;;;Uso interno;Bits de alteração input registers;;;;;;MASSA(500)!!!;;;;;;;;;;;;
