UUID;Teste automático;Modo;Tratamento;Tabela (Modbus);Tipo (Modbus);Registrador (Modbus);Tipo (DNP3);Índice (DNP3);Limite inferior;Limite superior;Valor default;Divisor;Unidade pt;Unidade en;Unidade es;Conversão pt;Conversão en;Conversão es;Opcional;Condicional;Nível de acesso;Descrição pt;Descrição en;Descrição es;Display pt;Display en;Display es;Observações;Funcionalidade pt;Funcionalidade en;Funcionalidade es;Grupo pt;Grupo en;Grupo es;Classificação;Gráfico rápido;Histórico de dados;IEC 61850;Link;CDC
da141e7744bc4f6cb113bc0f8a3ed1c8;1;R;16;TabLeituraGeral;Input register;1;Analog input;8;0;65535;0;1;;;;;;;;;Público;Indicação de segundo conjunto de alarmes;Indication of second alarms set;;;ALR2;;;;;;;;;Alarme;;;;;
faaeac63ce6248358e238d39533d0af3;1;R;16;TabLeituraGeral;Input register;2;Analog input;9;0;65535;0;1;;;;;;;;;Público;Indicação de primeiro conjunto da memória de alarmes;Indication of first alarms memory set;;;ALM1;;;;;;;;;Debug;;;;;
acbe22861de3430985062431012c896c;1;R;16;TabLeituraGeral;Input register;3;Analog input;10;0;65535;0;1;;;;;;;;;Público;Indicação de segundo conjunto da memória de alarmes;Indication of second alarms memory set;;;ALM2;;;;;;;;;Debug;;;;;
b0d170be382d4bb88f84a4b22dcee724;1;R;16;TabLeituraGeral;Input register;4;Analog input;11;0;65535;0;1;;;;;;;;;Público;Indicação de primeiro conjunto de autodiagnósticos;Indication of first self-diagnosis set;;;SDG1;;;;;;;;;Autodiagnóstico;;;;;
d5e20267f5cb4a1f9bb9d026116d9e95;1;R;16;TabLeituraGeral;Input register;5;Analog input;12;0;65535;0;1;;;;;;;;;Público;Indicação de segundo conjunto de autodiagnósticos;Indication of second self-diagnosis set;;;SDG2;;;;;;;;;Autodiagnóstico;;;;;
c71e101e4d74423d8715cc0065c3ed66;1;R;16;TabLeituraGeral;Input register;6;Analog input;13;0;65535;0;1;;;;;;;;;Público;Indicação de primeiro conjunto da memória de autodiagnósticos;Indication of first self-diagnosis memory set;;;DGM1;;;;;;;;;Debug;;;;;
03caba88059146be9a8ffbacf94b98fa;1;R;16;TabLeituraGeral;Input register;7;Analog input;14;0;65535;0;1;;;;;;;;;Público;Indicação de segundo conjunto da memória de autodiagnósticos;Indication of second self-diagnosis memory set;;;DGM2;;;;;;;;;Debug;;;;;
;;;;;;;;;;;;;;;;;;;;;;;;;;;;;;;;;;;;;;;;
fe72141f95b54c0cb5dcdf203aa9aa8a;1;R;16;TabLeituraRelogio;Input register;100;Analog input;17;0;65535;220;1;ms;;;;;;;;Público;Indicação de timestamp - H;Indication of timestamp - H;;;;;;;;;;;;Debug;;;;;
51e50d192a4f49279f651203a93c599a;1;R;16;TabLeituraRelogio;Input register;101;Analog input;18;0;65535;28057;1;ms;;;;;;;;Público;Indicação de timestamp - M;Indication of timestamp - M;;;;;;;;;;;;Debug;;;;;
4b39ed734faf41199372f3ea9eb0fba5;1;R;16;TabLeituraRelogio;Input register;102;Analog input;19;0;65535;51328;1;ms;;;;;;;;Público;Indicação de timestamp - L;Indication of timestamp - L;;;;;;;;;;;;Debug;;;;;
34f6c3b8e95c471898e81d5554b52238;1;R;16;TabLeituraRelogio;Input register;103;Analog input;20;1;12;1;1;;;;;;;;;Público;Indicação de mês atual no calendário do equipamento;Indication of current month on the equipment calendar;;;MNTH;;;;;;;;;;;;;;
32b6417fa97e4e74a1eea798703805ec;1;R;16;TabLeituraRelogio;Input register;104;Analog input;21;1;31;1;1;;;;;;;;;Público;Indicação de dia atual no calendário do equipamento;Indication of current day on the equipment calendar;;;DAY;;;;;;;;;;;;;;
a838f355af1d46aeb668b7ed7ecda463;1;R;16;TabLeituraRelogio;Input register;105;Analog input;22;2000;2099;2000;1;;;;;;;;;Público;Indicação de ano atual no calendário do equipamento;Indication of current year on the equipment calendar;;;YEAR;;;;;;;;;;;;;;
93ead70db03b4138b61b20d74b70e739;1;R;16;TabLeituraRelogio;Input register;106;Analog input;23;0;23;10;1;;;;;;;;;Público;Indicação de hora atual no relógio do equipamento;Indication of current hour on the equipment clock;;;HOUR;;;;;;;;;;;;;;
9acaf9f751af4d7cb79442f5df140b2e;1;R;16;TabLeituraRelogio;Input register;107;Analog input;24;0;59;0;1;;;;;;;;;Público;Indicação de minuto atual no relógio do equipamento;Indication of current minute on the equipment clock;;;MIN;;;;;;;;;;;;;;
a4120f33e2544bbea065cd4fcafb4143;1;R;16;TabLeituraRelogio;Input register;108;Analog input;25;0;59;0;1;;;;;;;;;Público;Indicação de segundo atual no relógio do equipamento;Indication of current second on the equipment clock;;;SEC;;;;;;;;;;;;;;
a2e33779475549b880105510f5c4facc;1;R;16;TabLeituraRelogio;Input register;109;Analog input;26;-12;14;-3;1;;;;;;;;;Público;Indicação de horas do fuso horário no relógio do equipamento;Indication of time zone hours on the equipment clock;;;TZ H;;;;;;;;;;;;;;
d1c8100df27c4eaca66833491742247b;1;R;16;TabLeituraRelogio;Input register;110;Analog input;27;0;59;0;1;;;;;;;;;Público;Indicação de minutos do fuso horário no relógio do equipamento;Indication of time zone minutes on the equipment clock;;;TZ M;;;;;;;;;;;;;;
1fed734468e3484b9121c482122970c8;1;R;16;TabLeituraRelogio;Input register;111;Analog input;28;0;6;6;1;;;;0=Domingo\1=Segunda-feira\2=Terça-feira\3=Quarta-feira\4=Quinta-feira\5=Sexta-feira\6=Sábado;0=Sunday\1=Monday\2=Tuesday\3=Wednesday\4=Thursday\5=Friday\6=Saturday;;;;Público;Indicação de dia da semana no calendário do equipamento;Indication of weekday on the equipment calendar;;;WDAY;;;;;;;;;;;;;;
;;;;;;;;;;;;;;;;;;;;;;;;;;;;;;;;;;;;;;;;
61bdca84697249628b6e2a54e4645dfb;1;R;16;TabLeituraComunicacao;Input register;600;Analog input;15;0;9999;0;1;;;;;;;;;Uso interno;Indicação de contador de bytes transmitidos pela UART;;;;;;;;;;;;;;;;;;
e4dff89e90354922af3c6144e965c70f;1;R;16;TabLeituraComunicacao;Input register;601;Analog input;16;0;9999;0;1;;;;;;;;;Uso interno;Indicação de contador de bytes recebidos pela UART;;;;;;;;;;;;;;;;;;
;;;;;;;;;;;;;;;;;;;;;;;;;;;;;;;;;;;;;;;;
17d2675fad2143baabdceb4a71c742d3;1;R;Bit;TabLeituraBinGeral;Discrete input;0;Binary input;0;0;1;0;1;;;;0=Inativo\1=Ativo;0=Inactive\1=Active;;;;Público;Indicação de autodiagnóstico por erro de parametrização;Indication of self-diagnosis for error on parametrization;;;;;;;;;;;;Autodiagnóstico;;;;;
a9a3dcdd15884f189f9e2427fd35dc16;1;R;Bit;TabLeituraBinGeral;Discrete input;1;Binary input;1;0;1;0;1;;;;0=Inativo\1=Ativo;0=Inactive\1=Active;;;;Público;Indicação de memória de autodiagnóstico por erro de parametrização;Indication of self-diagnosis memory for error on parametrization;;;;;;;;;;;;Debug;;;;;
75ff5d8cf6af4232928061016a3458a2;1;R;Bit;TabLeituraBinGeral;Discrete input;2;Binary input;2;0;1;0;1;;;;0=Inativo\1=Ativo;0=Inactive\1=Active;;;;Público;Indicação de autodiagnóstico por falha na leitura de variáveis auxiliares;Indication of self-diagnosis for fail in auxiliary variables reading;;;;;;;;;;;;Autodiagnóstico;;;;;
1574886303184463946ce726a4af0192;1;R;Bit;TabLeituraBinGeral;Discrete input;3;Binary input;3;0;1;0;1;;;;0=Inativo\1=Ativo;0=Inactive\1=Active;;;;Público;Indicação de memória de autodiagnóstico por falha na leitura de variáveis auxiliares;Indication of self-diagnosis memory for fail in auxiliary variables reading;;;;;;;;;;;;Debug;;;;;
8f5b44361168430383f96b30b3968220;1;R;Bit;TabLeituraBinGeral;Discrete input;4;Binary input;4;0;1;0;1;;;;0=Inativo\1=Ativo;0=Inactive\1=Active;;;;Público;Indicação de autodiagnóstico de falha na escrita da memória flash;Indication of self-diagnosis for fail flash memory write failure;;;;;;;;;;;;Autodiagnóstico;;;SDp_LAP_$LPHD1$ST$ErrMem$stVal;;
78302cb325234111b40b20493664c472;1;R;Bit;TabLeituraBinGeral;Discrete input;5;Binary input;5;0;1;0;1;;;;0=Inativo\1=Ativo;0=Inactive\1=Active;;;;Público;Indicação de memória de autodiagnóstico de escrita na memória flash;Indication of self-diagnosis memory for flash memory writing;;;;;;;;;;;;Debug;;;;;
31efbc5ae2a04e838412b9da485483dc;1;R;Bit;TabLeituraBinGeral;Discrete input;6;Binary input;6;0;1;0;1;;;;0=Sem autodiagnóstico ativo\1=Com autodiagnóstico ativo;0=No active self-diagnosis\1=Self-diagnosis active;;;;Público;Indicação de status geral dos autodiagnósticos;Indication of self-diagnosis status;;;;;;;;;;;;Autodiagnóstico;;;SDp_LAP_$LPHD1$ST$Err$stVal;;
74d0210803f4456782f6697ac679ac22;1;R;Bit;TabLeituraBinGeral;Discrete input;7;Binary input;7;0;1;0;1;;;;0=Sem alarme ativo\1=Com alarme ativo;0=No active alarms\1=Alarms active;;;;Público;Indicação de status geral dos alarmes;Indication of alarms status;;;;;;;;;;;;Autodiagnóstico;;;SDp_LAP_$LPHD1$ST$Alm$stVal;;
953db52962d74889871e095c27418e8f;1;R;Bit;TabLeituraBinGeral;Discrete input;8;;;0;1;1;1;;;;0=Inativo\1=Ativo;0=Inactive\1=Active;;;;Público;Indicação de aviso de atraso do relógio;Indication of warning by clock delay;;;;;;;;;;;;Autodiagnóstico;;;;;
;;;;;;;;;;;;;;;;;;;;;;;;;;;;;;;;;;;;;;;;
ab3f86cb97b0414cb141577f4417009c;1;R;Bit;TabLeituraBinRele;Discrete input;100;Binary input;8;0;1;0;1;;;;0=Inativo\1=Ativo;0=Inactive\1=Active;;;;Público;Indicação de status do relé 1;Indication of relay 1 status;;;;;;;;;Relés;Relays;;Geral;;Sim;;;
b98b6d620a8a42ce95a0537da5e0b8a3;1;R;Bit;TabLeituraBinRele;Discrete input;101;Binary input;9;0;1;0;1;;;;0=Não acionado\1=Acionado;0=Not triggered\1=Triggered;;;;Público;Indicação de status do relé 2;Indication of relay 2 status;;;;;;;;;Relés;Relays;;Geral;;Sim;;;
b1e6f314e33343d7a11d87c87115ad02;1;R;Bit;TabLeituraBinRele;Discrete input;102;Binary input;10;0;1;0;1;;;;0=Não acionado\1=Acionado;0=Not triggered\1=Triggered;;;;Público;Indicação de status do relé 3;Indication of relay 3 status;;;;;;;;;Relés;Relays;;Geral;;Sim;;;
cb2660c637164bb19b21f3b40cb7959f;1;R;Bit;TabLeituraBinRele;Discrete input;103;Binary input;11;0;1;0;1;;;;0=Não acionado\1=Acionado;0=Not triggered\1=Triggered;;;;Público;Indicação de status do relé 4;Indication of relay 4 status;;;;;;;;;Relés;Relays;;Geral;;Sim;;;
e9cde802eb3241508e7de2805d49ad39;1;R;Bit;TabLeituraBinRele;Discrete input;104;Binary input;12;0;1;0;1;;;;0=Não acionado\1=Acionado;0=Not triggered\1=Triggered;;;;Público;Indicação de status da saída digital;Indication of digital output status;;;;;;;;;Relés;Relays;;Geral;;Sim;;;
;;;;;;;;;;;;;;;;;;;;;;;;;;;;;;;;;;;;;;;;
6b1d49a7383a437b8e709c129b483114;1;RW;16;TabEscritaGeral;Holding register;0;Analog output;0;0;2;1;1;;;;0=Fixo\1=Rolando\2=Temperatura mais alta;0=Fixed\1=Rolling\2=Higher temperature;;;;Público;Parâmetro de tipo de scroll do display;Parameter of display scroll type;;;CONF\DISP;;;;;;;;;;;;;;
;;;;;;;;;;;;;;;;;;;;;;;;;;;;;;;;;;;;;;;;
052f076557314ff985da32146d93484c;1;RW;16;TabEscritaReles;Holding register;100;Analog output;1;1;9999;10;10;s;;;;;;;;Público;Parâmetro de configuração do relé 1 no modo pulse - Tempo ativo;Paramemeter of relay 1 pulse mode configuration - Active time;;;RELA\RL1\PON;;;;;;Relés;Relays;;Parâmetro;;;;;
a72732fc5715456c9eea001445786a05;1;RW;16;TabEscritaReles;Holding register;101;Analog output;2;0;9999;40;10;s;;;;;;;;Público;Parâmetro de configuração do relé 1 no modo pulse - Intervalo entre pulsos;Paramemeter of relay 1 pulse mode configuration - Pulses interval;;;RELA\RL1\POFF;;;;;;Relés;Relays;;Parâmetro;;;;;
51898b95f9424c42828fd0b124d6ce98;1;RW;16;TabEscritaReles;Holding register;102;Analog output;3;1;9999;10;10;s;;;;;;;;Público;Parâmetro de configuração do relé 2 no modo pulse - Tempo ativo;Paramemeter of relay 2 pulse mode configuration - Active time;;;RELA\RL2\PON;;;;;;Relés;Relays;;Parâmetro;;;;;
d4ab2f0fffe94d988ab0aff3ab8502f6;1;RW;16;TabEscritaReles;Holding register;103;Analog output;4;0;9999;40;10;s;;;;;;;;Público;Parâmetro de configuração do relé 2 no modo pulse - Intervalo entre pulsos;Paramemeter of relay 2 pulse mode configuration - Pulses interval;;;RELA\RL2\POFF;;;;;;Relés;Relays;;Parâmetro;;;;;
35e7273fb67e439e8b98667381c6375a;1;RW;16;TabEscritaReles;Holding register;104;Analog output;5;1;9999;10;10;s;;;;;;;;Público;Parâmetro de configuração do relé 3 no modo pulse - Tempo ativo;Paramemeter of relay 3 pulse mode configuration - Active time;;;RELA\RL3\PON;;;;;;Relés;Relays;;Parâmetro;;;;;
bb50577f3a8f4079a27f4a54dcd5a40a;1;RW;16;TabEscritaReles;Holding register;105;Analog output;6;0;9999;40;10;s;;;;;;;;Público;Parâmetro de configuração do relé 3 no modo pulse - Intervalo entre pulsos;Paramemeter of relay 3 pulse mode configuration - Pulses interval;;;RELA\RL3\POFF;;;;;;Relés;Relays;;Parâmetro;;;;;
2bf8dd28add54fc894b9ccc1df192aca;1;RW;16;TabEscritaReles;Holding register;106;Analog output;7;1;9999;10;10;s;;;;;;;;Público;Parâmetro de configuração do relé 4 no modo pulse - Tempo ativo;Paramemeter of relay 4 pulse mode configuration - Active time;;;RELA\RL4\PON;;;;;;Relés;Relays;;Parâmetro;;;;;
d22df0be5cc54457b47b9819783f7827;1;RW;16;TabEscritaReles;Holding register;107;Analog output;8;0;9999;40;10;s;;;;;;;;Público;Parâmetro de configuração do relé 4 no modo pulse - Intervalo entre pulsos;Paramemeter of relay 4 pulse mode configuration - Pulses interval;;;RELA\RL4\POFF;;;;;;Relés;Relays;;Parâmetro;;;;;
2ebc9d3e70ba4bfcbfe9fd49dd27a55f;1;RW;16;TabEscritaReles;Holding register;108;Analog output;9;1;9999;10;10;s;;;;;;;;Público;Parâmetro de configuração da saída digital no modo pulse - Tempo ativo;Paramemeter of digital output pulse mode configuration - Active time;;;RELA\VRL\PON;;;;;;Saída digital;Digital output;;Parâmetro;;;;;
1065fefc4b204059850ae74135aa31be;1;RW;16;TabEscritaReles;Holding register;109;Analog output;10;0;9999;40;10;s;;;;;;;;Público;Parâmetro de configuração da saída digital no modo pulse - Intervalo entre pulsos;Paramemeter of digital output pulse mode configuration - Pulses interval;;;RELA\VRL\POFF;;;;;;Saída digital;Digital output;;Parâmetro;;;;;
;;;;;;;;;;;;;;;;;;;;;;;;;;;;;;;;;;;;;;;;
060c4140189f430fa3b968daee88ad80;1;RW;16;TabEscritaSaidaAnalogica;Holding register;200;Analog output;11;0;2;0;1;;;;0=Standard\1=Relé Virtual Sinalização\2=Relé Virtual Eletromecânico;0=Standard\1=Virtual Relay Signaling\2=Electromechanical Virtual Relay;;;;Público;Parâmetro de modo de operação da saída analógica;Parameter of analogue output operation mode;;;ANOU\CONF\MODE;;;;;;Saída analógica;Analog output;;Parâmetro;;;;;
2913193f320840709cd6dda39fd663ef;1;RW;16;TabEscritaSaidaAnalogica;Holding register;201;Analog output;12;0;4;4;1;;;;0=0 a 1 mA\1=0 a 5 mA\2=0 a 10 mA\3=0 a 20 mA\4=4 a 20 mA;0=0 to 1 mA\1=0 to 5 mA\2=0 to 10 mA\3=0 to 20 mA\4=4 to 20 mA;;;;Público;Parâmetro de faixa da saída analógica;Parameter of analogue output range;;;ANOU\CONF\AORG;;;;;;Saída analógica;Analog output;;Parâmetro;;;;;
82c2252790d8428189e5f697b02920dc;1;RW;16;TabEscritaSaidaAnalogica;Holding register;202;Analog output;13;-55;250;0;1;°C;;;;;;;;Público;Parâmetro de início de escala da saída analógica;Parameter of analogue output zero scale;;;ANOU\CONF\BSCA;;;;;;Saída analógica;Analog output;;Parâmetro;;;;;
755e5d8fa63f4731bcbf94f439fed48d;1;RW;16;TabEscritaSaidaAnalogica;Holding register;203;Analog output;14;-55;250;250;1;°C;;;;;;;;Público;Parâmetro de fim de escala da saída analógica;Parameter of analogue output full scale;;;ANOU\CONF\FSCA;;;;;;Saída analógica;Analog output;;Parâmetro;;;;;
36efb0bed837439fa511ad52813c3fb0;1;RW;16;TabEscritaSaidaAnalogica;Holding register;204;Analog output;15;0;6;0;1;;;;0=Temperatura mais alta\1=RTD1\2=RTD2\3=RTD3\4=RTD4\5=RTD5\6=RTD6;0=Higher temperature\1=RTD1\2=RTD2\3=RTD3\4=RTD4\5=RTD5\6=RTD6;;;;Público;Parâmetro de variável associada à saída analógica;Parameter of analogue output variable;;;ANOU\CONF\ANIN;;;;;;Saída analógica;Analog output;;Parâmetro;;;;;
82e2f9aa6e95480c9e17fa606ae63de0;1;RW;16;TabEscritaSaidaAnalogica;Holding register;205;Analog output;16;1;20;10;1;mA;;;;;;;;Público;Parâmetro de corrente de saída da saída digital de sinalização;Parameter of output current of signaling digital output;;;ANOU\CONF\COUT;;;;;;Saída analógica;Analog output;;Parâmetro;;;;;
;;;;;;;;;;;;;;;;;;;;;;;;;;;;;;;;;;;;;;;;
9321be2554214f61bdee19ba41585a18;1;RW;16;TabEscritaGeralProtegida;Holding register;300;;;0;8191;0;1;;;;;;;;;Público;Parâmetro de senha de acesso ao menu de configuração do LAP;Parameter of LAP menu configuration password;;;CONF\PSWD;;;;;;;;;;;;;;
;;;;;;;;;;;;;;;;;;;;;;;;;;;;;;;;;;;;;;;;
c5d9c164ce344cf092caac6be16d72f0;1;RW;16;TabEscritaConfigComunic;Holding register;400;;;0;5;1;1;;;;0=4800 bps\1=9600 bps\2=19200 bps\3=38400 bps\4=57600 bps\5=115200 bps;0=4800 bps\1=9600 bps\2=19200 bps\3=38400 bps\4=57600 bps\5=115200 bps;;;;Público;Parâmetro de baudrate;Parameter of baudrate;;;COMM\BDR;;;;;;;;;;;;;;
9c7fa82d2d6d43a88234b01d853075d4;1;RW;16;TabEscritaConfigComunic;Holding register;401;;;1;247;247;1;;;;;;;;;Público;Parâmetro de endereço da comunicação pelo protocolo modbus;Parameter of modbus protocol comunication address;;;COMM\ADDR;;;;;;;;;;;;;;
cc9084ca173d4388a13dbc5ec897197a;1;RW;16;TabEscritaConfigComunic;Holding register;402;;;1;65535;247;1;;;;;;;;;Público;Parâmetro de endereço da comunicação pelo protocolo DNP;Parameter of DNP protocol comunication address;;;;;;;;;;;;;;;;;
cdffb0223d884b2ba049d58f4643fd50;1;RW;16;TabEscritaConfigComunic;Holding register;403;;;0;1;0;1;;;;0=Modbus\1=DNP3;0=Modbus\1=DNP3;;;;Público;Parâmetro de protocolo;Parameter of protocol;;;COMM\PROT;;;;;;;;;;;;;;
c33a38dde44542cabb6c9eefe7199f9e;1;RW;16;TabEscritaConfigComunic;Holding register;404;;;5;500;25;1;ms;;;;;;;;Público;Parâmetro de delay TX (antes da transmissão);Parameter of TX delay;;;COMM\TXDL;;;;;;;;;;;;;;
6df578025af7421f9ab523ebada1c168;1;RW;16;TabEscritaConfigComunic;Holding register;405;;;5;500;5;1;ms;;;;;;;;Público;Parâmetro de delay RX (depois da recepção);Parameter of RX delay;;;COMM\RXDL;;;;;;;;;;;;;;
;;;;;;;;;;;;;;;;;;;;;;;;;;;;;;;;;;;;;;;;
d3f1b844bf504e44b1f00619e7e285b6;1;RW;16;TabEscritaLogMemMassa;Holding register;500;Analog output;62;60;9999;60;1;minutos;;;;;;;;Público;Parâmetro de tempo entre gravações da memória de massa;Parameter of time between mass memory recordings;;;LOGS\MMEM\TIME;;;;;;LOG;LOG;;Parâmetro;;;;;
8a02d24ca6ae4de6a2b534390dcdba5b;1;RW;16;TabEscritaLogMemMassa;Holding register;501;Analog output;63;1;20;5;1;°C;;;;;;;;Público;Parâmetro de limite de variação da temperatura para gravação da memória de massa;Parameter of temperature variation limit for mass memory recording;;;LOGS\MMEM\VAR;;;;;;LOG;LOG;;Parâmetro;;;;;
;;;;;;;;;;;;;;;;;;;;;;;;;;;;;;;;;;;;;;;;
48eb694b681a4123a130b62b47a278e3;0;RW;Bit;TabEscritaBinGeral;Coil;0;Binary output;0;0;1;0;1;;;;0=-\1=Efetua reset;0=-\1=Perform reset;;;;Público;Comando de reset do primeiro conjunto da memória de autodiagnósticos;Command of self-diagnosis memory first set reset;;;;;;;;;;;;Comando;;;;;
d9bec0bdb610467c9961aeba8f3232fc;0;RW;Bit;TabEscritaBinGeral;Coil;1;Binary output;1;0;1;0;1;;;;0=-\1=Efetua reset;0=-\1=Perform reset;;;;Público;Comando de reset do segundo conjunto da memória de autodiagnósticos;Command of self-diagnosis memory second set reset;;;;;;;;;;;;Comando;;;;;
fce175e8eaec4d35825e4b9327c288f8;0;RW;Bit;TabEscritaBinGeral;Coil;2;Binary output;2;0;1;0;1;;;;0=-\1=Efetua reset;0=-\1=Perform reset;;;;Público;Comando de reset do primeiro conjunto da memória de alarmes;Command of alarms memory first set reset;;;;;;;;;;;;Comando;;;;;
ca587b40cf5c41f597062983e56d2e5a;0;RW;Bit;TabEscritaBinGeral;Coil;3;Binary output;3;0;1;0;1;;;;0=-\1=Efetua reset;0=-\1=Perform reset;;;;Público;Comando de reset do segundo conjunto da memória de alarmes;Command of alarms memory second set reset;;;;;;;;;;;;Comando;;;;;
327788f6ff804fbbb0f7f2ede008e29c;0;RW;Bit;TabEscritaBinGeral;Coil;4;;;0;1;0;1;;;;0=-\1=Executa o comando;0=-\1=Execute the command;;;;Público;Comando de forçar a aplicação dos parâmetros de comunicação;Command of forcing application of communication parameters;;;;;;;;;;;;Comando;;;;;
;;;;;;;;;;;;;;;;;;;;;;;;;;;;;;;;;;;;;;;;
23d085ff870e441fb7ae4a633dddd382;1;RW;Bit;TabEscritaBinRele;Coil;100;Binary output;4;0;1;0;1;;;;0=Normal\1=Invertido;0=Normal\1=Inverted;;;;Público;Parâmetro de modo de operação do relé 1;Parameter of relay 1 operation mode;;;RELA\RL1\MODE;;;;;;Relés;Relays;;Parâmetro;;;;;
7e32f1d4497341fab9e45811df656a4e;1;RW;Bit;TabEscritaBinRele;Coil;101;Binary output;5;0;1;0;1;;;;0=Latch\1=Pulse;0=Latch\1=Pulse;;;;Público;Parâmetro de modo de acionamento do relé 1;Parameter of relay 1 trigger mode;;;RELA\RL1\ACTM;;;;;;Relés;Relays;;Parâmetro;;;;;
7d04db850c154ab8a2e9aaf8db22e8e1;1;RW;Bit;TabEscritaBinRele;Coil;102;Binary output;6;0;1;0;1;;;;0=Não\1=Sim;0=No\1=Yes;;;;Público;Parâmetro de associação do relé 1 aos alarmes por temperatura alta;Parameter of relay 1 assigned to alarms by high temperature;;;RELA\RL1\ALR;;;;;;Associação de relés;Relay association;;Debug;;;;;
c5ef6c13e6054b7aa8f6482f89202ade;1;RW;Bit;TabEscritaBinRele;Coil;103;Binary output;7;0;1;0;1;;;;0=Não\1=Sim;0=No\1=Yes;;;;Público;Parâmetro de associação do relé 1 aos desligamentos por temperatura alta;Parameter of relay 1 assigned to trips by high temperature;;;RELA\RL1\TRIP;;;;;;Associação de relés;Relay association;;Debug;;;;;
280c043842bd48ffbd1b80774cac91a8;1;RW;Bit;TabEscritaBinRele;Coil;104;Binary output;8;0;1;1;1;;;;0=Não\1=Sim;0=No\1=Yes;;;;Público;Parâmetro de associação do relé 1 aos autodiagnósticos;Parameter of relay 1 assigned to self-diagnosis;;;RELA\RL1\FAIL;;;;;;Associação de relés;Relay association;;Debug;;;;;
3f24894735084192862de07365a1da23;1;RW;Bit;TabEscritaBinRele;Coil;105;Binary output;9;0;1;0;1;;;;0=Não\1=Sim;0=No\1=Yes;;;;Público;Parâmetro de associação do relé 1 ao grupo de resfriamento 1;Parameter of relay 1 assigned to cooling group 1;;;RELA\RL1\CG1;;;;;;Associação de relés;Relay association;;Debug;;;;;
cc77fbeba09341ab8fd2cf526f41eb1f;1;RW;Bit;TabEscritaBinRele;Coil;106;Binary output;10;0;1;0;1;;;;0=Não\1=Sim;0=No\1=Yes;;;;Público;Parâmetro de associação do relé 1 ao grupo de resfriamento 2;Parameter of relay 1 assigned to cooling group 2;;;RELA\RL1\CG2;;;;;;Associação de relés;Relay association;;Debug;;;;;
fa74191026294a5e8d2ed9a4fa156f30;1;RW;Bit;TabEscritaBinRele;Coil;107;Binary output;11;0;1;0;1;;;;0=Não\1=Sim;0=No\1=Yes;;;;Público;Parâmetro de associação do relé 1 aos alarmes por envelhecimento;Parameter of relay 1 assigned to aging alarms;;;RELA\RL1\INSA;;;;;;Associação de relés;Relay association;;Debug;;;;;
47b77ac46ac34201ae642be2ad8f60fa;1;RW;Bit;TabEscritaBinRele;Coil;108;Binary output;12;0;1;0;1;;;;0=Normal\1=Invertido;0=Normal\1=Inverted;;;;Público;Parâmetro de modo de funcionamento do relé 2;Parameter of relay 2 operation mode;;;RELA\RL2\MODE;;;;;;Relés;Relays;;Parâmetro;;;;;
5f27861a5ae94c44b7adc95f6e266340;1;RW;Bit;TabEscritaBinRele;Coil;109;Binary output;13;0;1;0;1;;;;0=Latch\1=Pulse;0=Latch\1=Pulse;;;;Público;Parâmetro de modo de acionamento do relé 2;Parameter of relay 2 trigger mode;;;RELA\RL2\ACTM;;;;;;Relés;Relays;;Parâmetro;;;;;
6e05409d3aba4012a1a8a96bba362242;1;RW;Bit;TabEscritaBinRele;Coil;110;Binary output;14;0;1;0;1;;;;0=Não\1=Sim;0=No\1=Yes;;;;Público;Parâmetro de associação do relé 2 aos alarmes por temperatura alta;Parameter of relay 2 assigned to alarms by high temperature;;;RELA\RL2\ALR;;;;;;Associação de relés;Relay association;;Debug;;;;;
53e6b9a1f51247a8b2b96cd3a13d84ea;1;RW;Bit;TabEscritaBinRele;Coil;111;Binary output;15;0;1;1;1;;;;0=Não\1=Sim;0=No\1=Yes;;;;Público;Parâmetro de associação do relé 2 aos desligamentos por temperatura alta;Parameter of relay 2 assigned to trips by high temperature;;;RELA\RL2\TRIP;;;;;;Associação de relés;Relay association;;Debug;;;;;
fb9a205de31c4c4dafb3ddbfe8075608;1;RW;Bit;TabEscritaBinRele;Coil;112;Binary output;16;0;1;0;1;;;;0=Não\1=Sim;0=No\1=Yes;;;;Público;Parâmetro de associação do relé 2 aos autodiagnósticos;Parameter of relay 2 assigned to self-diagnosis;;;RELA\RL2\FAIL;;;;;;Associação de relés;Relay association;;Debug;;;;;
2fa38c5668644a908a367b880f01a5ed;1;RW;Bit;TabEscritaBinRele;Coil;113;Binary output;17;0;1;0;1;;;;0=Não\1=Sim;0=No\1=Yes;;;;Público;Parâmetro de associação do relé 2 ao grupo de resfriamento 1;Parameter of relay 2 assigned to cooling group 1;;;RELA\RL2\CG1;;;;;;Associação de relés;Relay association;;Debug;;;;;
f713227c51994a8bbd191d6c2639817c;1;RW;Bit;TabEscritaBinRele;Coil;114;Binary output;18;0;1;0;1;;;;0=Não\1=Sim;0=No\1=Yes;;;;Público;Parâmetro de associação do relé 2 ao grupo de resfriamento 2;Parameter of relay 2 assigned to cooling group 2;;;RELA\RL2\CG2;;;;;;Associação de relés;Relay association;;Debug;;;;;
f82e30ca2c144b9ea24c3b3c8cbd0a70;1;RW;Bit;TabEscritaBinRele;Coil;115;Binary output;19;0;1;0;1;;;;0=Não\1=Sim;0=No\1=Yes;;;;Público;Parâmetro de associação do relé 2 aos alarmes por envelhecimento;Parameter of relay 2 assigned to aging alarms;;;RELA\RL2\INSA;;;;;;Associação de relés;Relay association;;Debug;;;;;
7e497c7f1a4648908305cbf52b564c92;1;RW;Bit;TabEscritaBinRele;Coil;116;Binary output;20;0;1;0;1;;;;0=Normal\1=Invertido;0=Normal\1=Inverted;;;;Público;Parâmetro de modo de funcionamento do relé 3;Parameter of relay 3 operation mode;;;RELA\RL3\MODE;;;;;;Relés;Relays;;Parâmetro;;;;;
87ec677afd0a4e39b5fbc87f2f3b605b;1;RW;Bit;TabEscritaBinRele;Coil;117;Binary output;21;0;1;0;1;;;;0=Latch\1=Pulse;0=Latch\1=Pulse;;;;Público;Parâmetro de modo de acionamento do relé 3;Parameter of relay 3 trigger mode;;;RELA\RL3\ACTM;;;;;;Relés;Relays;;Parâmetro;;;;;
631cb89b70274da9b461667fe28aea82;1;RW;Bit;TabEscritaBinRele;Coil;118;Binary output;22;0;1;1;1;;;;0=Não\1=Sim;0=No\1=Yes;;;;Público;Parâmetro de associação do relé 3 aos alarmes por temperatura alta;Parameter of relay 3 assigned to alarms by high temperature;;;RELA\RL3\ALR;;;;;;Associação de relés;Relay association;;Debug;;;;;
